{
  "schema_version": 2,
  "profile_order": [
    "smoke",
    "standard",
    "full"
  ],
  "runs": [
    {
      "id": "20260921-195542",
      "profile": "smoke",
      "benchmark_version": "0.9.0",
      "started_at": "2026-09-21T17:55:42.844919+00:00",
      "finished_at": "2026-09-21T18:29:38.993042+00:00",
      "provenance": {
        "run_schema_version": 4,
        "report_schema_version": 4,
        "run_sha256": "3f5b1488df38f7b1b867e4300b772e86e6ed2461e31d62e469c8e4f3209ee90c",
        "report_sha256": "9d1f2d249272fb82e38d824f579c2d85052776970fdced55443472fe30c783c1",
        "repository_commit": "b855817a60c0894615afdbc8bcc2bc8ee5f5f870"
      },
      "sandbox": {
        "backend": "audit-only",
        "enforced": false,
        "filesystem_isolation": false,
        "process_isolation": false,
        "network_isolation": false
      },
      "integrity": {
        "status": "violations_detected",
        "disqualified_models": [
          "deepcoder:14b",
          "gpt-oss:20b"
        ]
      },
      "thinking_control": {
        "version": 1,
        "status": "partial",
        "requested": "off",
        "reasoning_effort": "none",
        "source": "explicit_sampling_parameter"
      },
      "participants": [
        "cogito:14b",
        "deepcoder:14b",
        "devstral:24b",
        "falcon3:10b",
        "gemma4:12b-mlx",
        "gemma4:e4b-mlx",
        "gpt-oss:20b",
        "granite4.1:8b",
        "ministral-3:14b",
        "phi4-reasoning:14b",
        "qwen2.5-coder:14b",
        "qwen3.5:9b-mlx",
        "qwen3.8:27b-mlx",
        "qwen3:14b"
      ],
      "leaderboard": [
        {
          "rank": 1,
          "model": "qwen3.5:9b-mlx",
          "overall_score": 86.19,
          "quality_score": 83.0,
          "completion_rate": 100.0,
          "speed_score": 99.58,
          "token_efficiency_score": 96.13,
          "median_duration_seconds": 267.165,
          "median_output_tokens": 6098.0,
          "median_cpu_seconds": 1.367,
          "median_energy_joules": null,
          "score_stddev": 0.0,
          "successful_tasks": 1,
          "total_tasks": 1,
          "case_scores": {
            "targeted_patch": 83.0
          }
        },
        {
          "rank": 2,
          "model": "gemma4:12b-mlx",
          "overall_score": 74.4,
          "quality_score": 68.0,
          "completion_rate": 100.0,
          "speed_score": 100.0,
          "token_efficiency_score": 100.0,
          "median_duration_seconds": 266.052,
          "median_output_tokens": 5862.0,
          "median_cpu_seconds": 0.655,
          "median_energy_joules": null,
          "score_stddev": 0.0,
          "successful_tasks": 1,
          "total_tasks": 1,
          "case_scores": {
            "targeted_patch": 68.0
          }
        },
        {
          "rank": 3,
          "model": "qwen3:14b",
          "overall_score": 39.2,
          "quality_score": 49.0,
          "completion_rate": 0.0,
          "speed_score": 0.0,
          "token_efficiency_score": 0.0,
          "median_duration_seconds": 310.222,
          "median_output_tokens": 2049.0,
          "median_cpu_seconds": 0.86,
          "median_energy_joules": null,
          "score_stddev": 0.0,
          "successful_tasks": 0,
          "total_tasks": 1,
          "case_scores": {
            "targeted_patch": 49.0
          }
        },
        {
          "rank": 4,
          "model": "granite4.1:8b",
          "overall_score": 25.6,
          "quality_score": 32.0,
          "completion_rate": 0.0,
          "speed_score": 0.0,
          "token_efficiency_score": 0.0,
          "median_duration_seconds": 200.889,
          "median_output_tokens": 2244.0,
          "median_cpu_seconds": 1.024,
          "median_energy_joules": null,
          "score_stddev": 0.0,
          "successful_tasks": 0,
          "total_tasks": 1,
          "case_scores": {
            "targeted_patch": 32.0
          }
        },
        {
          "rank": 5,
          "model": "falcon3:10b",
          "overall_score": 20.0,
          "quality_score": 25.0,
          "completion_rate": 0.0,
          "speed_score": 0.0,
          "token_efficiency_score": 0.0,
          "median_duration_seconds": 0.28,
          "median_output_tokens": 0.0,
          "median_cpu_seconds": 0.28,
          "median_energy_joules": null,
          "score_stddev": 0.0,
          "successful_tasks": 0,
          "total_tasks": 1,
          "case_scores": {
            "targeted_patch": 25.0
          }
        },
        {
          "rank": 6,
          "model": "phi4-reasoning:14b",
          "overall_score": 20.0,
          "quality_score": 25.0,
          "completion_rate": 0.0,
          "speed_score": 0.0,
          "token_efficiency_score": 0.0,
          "median_duration_seconds": 0.287,
          "median_output_tokens": 0.0,
          "median_cpu_seconds": 0.284,
          "median_energy_joules": null,
          "score_stddev": 0.0,
          "successful_tasks": 0,
          "total_tasks": 1,
          "case_scores": {
            "targeted_patch": 25.0
          }
        },
        {
          "rank": 7,
          "model": "qwen3.8:27b-mlx",
          "overall_score": 20.0,
          "quality_score": 25.0,
          "completion_rate": 0.0,
          "speed_score": 0.0,
          "token_efficiency_score": 0.0,
          "median_duration_seconds": 20.368,
          "median_output_tokens": 0.0,
          "median_cpu_seconds": 0.483,
          "median_energy_joules": null,
          "score_stddev": 0.0,
          "successful_tasks": 0,
          "total_tasks": 1,
          "case_scores": {
            "targeted_patch": 25.0
          }
        },
        {
          "rank": 8,
          "model": "gemma4:e4b-mlx",
          "overall_score": 20.0,
          "quality_score": 25.0,
          "completion_rate": 0.0,
          "speed_score": 0.0,
          "token_efficiency_score": 0.0,
          "median_duration_seconds": 22.943,
          "median_output_tokens": 155.0,
          "median_cpu_seconds": 0.595,
          "median_energy_joules": null,
          "score_stddev": 0.0,
          "successful_tasks": 0,
          "total_tasks": 1,
          "case_scores": {
            "targeted_patch": 25.0
          }
        },
        {
          "rank": 9,
          "model": "ministral-3:14b",
          "overall_score": 20.0,
          "quality_score": 25.0,
          "completion_rate": 0.0,
          "speed_score": 0.0,
          "token_efficiency_score": 0.0,
          "median_duration_seconds": 130.283,
          "median_output_tokens": 239.0,
          "median_cpu_seconds": 0.55,
          "median_energy_joules": null,
          "score_stddev": 0.0,
          "successful_tasks": 0,
          "total_tasks": 1,
          "case_scores": {
            "targeted_patch": 25.0
          }
        },
        {
          "rank": 10,
          "model": "devstral:24b",
          "overall_score": 20.0,
          "quality_score": 25.0,
          "completion_rate": 0.0,
          "speed_score": 0.0,
          "token_efficiency_score": 0.0,
          "median_duration_seconds": 187.23,
          "median_output_tokens": 56.0,
          "median_cpu_seconds": 0.691,
          "median_energy_joules": null,
          "score_stddev": 0.0,
          "successful_tasks": 0,
          "total_tasks": 1,
          "case_scores": {
            "targeted_patch": 25.0
          }
        },
        {
          "rank": 11,
          "model": "qwen2.5-coder:14b",
          "overall_score": 20.0,
          "quality_score": 25.0,
          "completion_rate": 0.0,
          "speed_score": 0.0,
          "token_efficiency_score": 0.0,
          "median_duration_seconds": 196.308,
          "median_output_tokens": 793.0,
          "median_cpu_seconds": 0.676,
          "median_energy_joules": null,
          "score_stddev": 0.0,
          "successful_tasks": 0,
          "total_tasks": 1,
          "case_scores": {
            "targeted_patch": 25.0
          }
        },
        {
          "rank": 12,
          "model": "cogito:14b",
          "overall_score": 20.0,
          "quality_score": 25.0,
          "completion_rate": 0.0,
          "speed_score": 0.0,
          "token_efficiency_score": 0.0,
          "median_duration_seconds": 197.531,
          "median_output_tokens": 773.0,
          "median_cpu_seconds": 0.882,
          "median_energy_joules": null,
          "score_stddev": 0.0,
          "successful_tasks": 0,
          "total_tasks": 1,
          "case_scores": {
            "targeted_patch": 25.0
          }
        }
      ],
      "tasks": [
        {
          "model": "cogito:14b",
          "case_id": "targeted_patch",
          "case_title": "Patch mirata con regressioni e documentazione",
          "case_title_en": "Targeted patch with regressions and documentation",
          "category": "implementation",
          "repetition": 1,
          "status": "ok",
          "state": "below_threshold",
          "score": 25,
          "max_score": 100,
          "duration_seconds": 197.531,
          "output_tokens": 773,
          "tool_calls": 1,
          "tool_errors": 1,
          "cpu_seconds": 0.881569,
          "energy_joules": null,
          "integrity_valid": true
        },
        {
          "model": "devstral:24b",
          "case_id": "targeted_patch",
          "case_title": "Patch mirata con regressioni e documentazione",
          "case_title_en": "Targeted patch with regressions and documentation",
          "category": "implementation",
          "repetition": 1,
          "status": "ok",
          "state": "below_threshold",
          "score": 25,
          "max_score": 100,
          "duration_seconds": 187.23,
          "output_tokens": 56,
          "tool_calls": 2,
          "tool_errors": 0,
          "cpu_seconds": 0.691421,
          "energy_joules": null,
          "integrity_valid": true
        },
        {